Video name,Video link,Channel Name,Channel link
FIRST VIDEO IN NEW HOUSE,https://www.youtube.com/watch?v=ItHV173bznQ,GothamChess,https://www.youtube.com/c/GothamChess
Sundays with PokerStars Ft. @Munawar Faruqui @GamerFleet @Suhani Shah @Aishwarya Mohanraj,https://www.youtube.com/watch?v=mVofIi8unn8,Samay Raina,https://www.youtube.com/c/SamayRainaOfficial
Build Your First Blockchain App Using Ethereum Smart Contracts and Solidity,https://www.youtube.com/watch?v=coQ5dg8wM2o,freeCodeCamp.org,https://www.youtube.com/c/Freecodecamp
Inspiring Strangers Through Freestyle | Harry Mack Omegle Bars 43,https://www.youtube.com/watch?v=oXI3ysg3s3s,Harry Mack,https://www.youtube.com/channel/UC59ZRYCHev_IqjUhremZ8Tg
HDKಯ ಅಡ್ಡಡ್ಡ ಮಲಗಿಸಿ ಹೇಳಿಕೆಗೆ ಅಭಿ ಟಾಂಗ್​ | Abhishek Ambareesh | Sumalatha | NewsFirst Kannada,https://www.youtube.com/watch?v=1kYc9CwN_Hc,NewsFirst Kannada,https://www.youtube.com/c/NewsFirstKannada
5 Ways to Get Rich,https://www.youtube.com/watch?v=GECfvGtAVv4,Karan Singh Boomer,https://www.youtube.com/c/KaranSinghBoomer
Trackmania Rewind - All 39+ World Records from 2020 Analyzed!,https://www.youtube.com/watch?v=zrfqlQtal58,WirtualTV,https://www.youtube.com/c/WirtualTV
"I Finally Beat ""Russian Paul,"" The Strongest Chess Hustler in NYC",https://www.youtube.com/watch?v=k3eEwYI6awM,BotezLive,https://www.youtube.com/c/BotezLive
Please Don't Use GitHub Copilot,https://www.youtube.com/watch?v=b9u3ZAGQmT0,Engineer Man,https://www.youtube.com/c/EngineerMan
JORDINDIAN | Types of News Reporters | News Channels | Reaction by Jaby Koay & Achara Kirk!,https://www.youtube.com/watch?v=qQ3NIPfRhDI,jaby koay,https://www.youtube.com/c/jabykoay
How Hackers Get Free Membership On Any Website!,https://www.youtube.com/watch?v=MEyyegfvhwM,Loi Liang Yang,https://www.youtube.com/c/LoiLiangYang
"Offering Kids $100,000 To Quit School",https://www.youtube.com/watch?v=urtFrxDUV6c,MrBeast,https://www.youtube.com/c/MrBeast6000
🔴Sundays w @PokerStars India @Samay Raina@GamerFleet@Aishwarya Mohanraj@Munawar Faruqui@Suhani Shah,https://www.youtube.com/watch?v=gF_1QHO4EIg,Tanmay Bhat,https://www.youtube.com/c/TanmayBhatYouTube
How many Programming Languages Should you Learn? (THE TRUTH!),https://www.youtube.com/watch?v=wRdPmY8yS1E,CodeWithHarry,https://www.youtube.com/c/CodeWithHarry
Nihal's Brilliancies Make Commentators Speechless,https://www.youtube.com/watch?v=t9gvA0wzBBo,Chesscom India,https://www.youtube.com/c/ChesscomIndia
Pokimane's 2021 ROOM TOUR + Gaming Setup!,https://www.youtube.com/watch?v=PWbnDoQwnW8,Pokimane,https://www.youtube.com/c/pokimane
"Ask me Anything ft. Kumar Varun, Prakhar Gupta",https://www.youtube.com/watch?v=UbtsNptg3u4,Samay Raina,https://www.youtube.com/c/SamayRainaOfficial
I Reviewed a Viewer's Trackmania Map,https://www.youtube.com/watch?v=ZIYOidTtG0w,Karlberg,https://www.youtube.com/c/KarlbergTM
Making Money As A Data Scientist- How I Doubled My Income💲 💲 💲 💲,https://www.youtube.com/watch?v=03vaBiyzpjc,Krish Naik,https://www.youtube.com/user/krishnaik06
Theoretical Physicist Breaks Down the Marvel Multiverse (ft. Michio Kaku) | WIRED,https://www.youtube.com/watch?v=FGP4KIkr2ls,WIRED,https://www.youtube.com/c/WIRED
The Magic Of Python,https://www.youtube.com/watch?v=ScUKeVuL7Y8,Tech With Tim,https://www.youtube.com/c/TechWithTim
"Minecraft, But On a Quantum Computer",https://www.youtube.com/watch?v=Xe_7b9pRKY8,Jabrils,https://www.youtube.com/c/Jabrils
Shruti Sinha Crushes...| Chest Workout Vlog | Fitnesstalks with Pranit,https://www.youtube.com/watch?v=HansY8cjiHA,Fitnesstalks,https://www.youtube.com/channel/UCgCP6fPIE9DHnzNL2Gqffzw
